{
  "app_artifact_sha256": "357f12102bb5e3961277f9f080018d21c5b2da14e330136d96167489fd013061",
  "app_executable_sha256": "5836af118988b91c6960956d0be09126ea36ecf14da27be0f7baf22018c3f215",
  "artifact_preflight_passes": 1,
  "artifact_signing_class": "development-signed",
  "audio_passes": 0,
  "bundled_vars_seed_sha256": "1be0240e2537e3c695596aeccd84efd51414385aa13de42a62d6e60a433654c4",
  "campaign_mode": "pilot",
  "capability_promotion": false,
  "claim_eligible": false,
  "clean_machine": false,
  "clipboard_passes": 0,
  "commit": "cfa9f436996eb80b8362892eba0e90ad14401ed7",
  "criterion": "A9",
  "criterion_pass": false,
  "elapsed_ms": 1878000,
  "expected_runs": 1,
  "failure_code": "installer-failed",
  "failures": 1,
  "final_disk_sha256": "absent",
  "final_vars_sha256": "absent",
  "finished_at": "2026-09-23T04:01:58Z",
  "firmware_sha256": "b1dc201b1382476ca8c8dcbf8c09abc7ae7429c8437e35bffd54bb9b228b750b",
  "first_ready_passes": 0,
  "first_shutdown_passes": 0,
  "folder_share_passes": 0,
  "gate_id": "windows-hvf-3d-off-product-e2e",
  "guest_evidence_sha256": "absent",
  "helper_sha256": "c94756ef8bfbc680e70a3ae00e736bfbb236087eb67b99e53769640822571b40",
  "host_model": "Mac17,9",
  "hosted_ci_commit": "cfa9f436996eb80b8362892eba0e90ad14401ed7",
  "hosted_ci_green": false,
  "hosted_ci_run_id": "absent",
  "input_manifest_sha256": "b85a6ee648dee59d161159cf64c9d24e716c4c01929a5063eedaf0451b1a5205",
  "installer_source_sha256": "absent",
  "iso_sha256": "638aa2c88e94385b00f4f178d071e3df0b7d9e335577a83bd533b7f2eb65adf0",
  "job_id": "t17-cfa9f436-selection-confirmation-r29",
  "keyboard_pointer_passes": 0,
  "macos_version": "27.0",
  "network_passes": 0,
  "outcome": "failed",
  "pass": false,
  "passes": 0,
  "product_model_automated": true,
  "run_count": 1,
  "runner_sha256": "84338c8298f399d242ff782abe16c2fb04f089dc7aba7dadd4ce66aa69dc61ec",
  "schema_version": "bridgevm.windows-hvf-3d-off-product-e2e.v1",
  "second_ready_passes": 0,
  "second_shutdown_passes": 0,
  "secure_boot_policy_sha256": "17b15f8e3501af3c22aff0b55957c4eb8a60ae4cdb4295ceb0782eab2901c60c",
  "secure_boot_provisioned_passes": 0,
  "secure_boot_receipt_sha256": "absent",
  "security_ci_green": false,
  "security_ci_run_id": "absent",
  "snapshot_restore_passes": 0,
  "source_prepared_passes": 0,
  "started_at": "2026-09-23T03:30:40Z",
  "tested_commit": "cfa9f436996eb80b8362892eba0e90ad14401ed7",
  "three_d_injection": false,
  "tier": "t17-windows-hvf-product-e2e",
  "ui_frontend_automated": true,
  "valid": true,
  "vm_created_passes": 1,
  "windows_installed_passes": 0,
  "worker_cleanup_verified": true
}
